USI	GNPSLibraryAccession	Cosine	Matching Peaks	CompoundName	Adduct	Charge
mzspec:GNPS:GNPS-LIBRARY:accession:CCMSLIB00009942570	CCMSLIB00009942570	0.98	8	Suspect related to Asp-Tyr (predicted molecular formula: C14H16N2O5) with delta m/z -3.995 (putative explanation: Pyro-Glu from E + Methylation|Thr->Pro substitution; atomic difference: 1C,-1O|1C,-1O)	[M+H]+	1
mzspec:GNPS:GNPS-LIBRARY:accession:CCMSLIB00009961825	CCMSLIB00009961825	0.98	8	Suspect related to Massbank:PR311057 Glutamyltyrosine (predicted molecular formula: C14H16N2O5) with delta m/z -18.011 (putative explanation: Dehydration|Pyro-glu from E|carbodiimide crosslinker; atomic difference: -2H,-1O|-2H,-1O|-2H,-1O)	[M+H]+	1
mzspec:GNPS:GNPS-LIBRARY:accession:CCMSLIB00009926178	CCMSLIB00009926178	0.92	7	Suspect related to .alpha.-L-Glu-L-Tyr (predicted molecular formula: unknown) with delta m/z -18.011 (putative explanation: Dehydration|Pyro-glu from E|carbodiimide crosslinker; atomic difference: -2H,-1O|-2H,-1O|-2H,-1O)	[M+H]+	1
mzspec:GNPS:GNPS-LIBRARY:accession:CCMSLIB00010001871	CCMSLIB00010001871	0.92	7	Suspect related to Thr-Tyr (predicted molecular formula: C14H16N2O5) with delta m/z 9.984 (putative explanation: unspecified; atomic difference: unspecified)	[M+H]+	1
mzspec:GNPS:GNPS-LIBRARY:accession:CCMSLIB00009993447	CCMSLIB00009993447	0.91	6	Suspect related to Spectral Match to Gly-Tyr from NIST14 (predicted molecular formula: C14H16N2O5) with delta m/z 54.01 (putative explanation: unspecified|Alkene fragment of DSSO crosslinker|MDA adduct +54|Methylglyoxal-derived hydroimidazolone|unspecified; atomic difference: 1C,3N|3C,2H,1O|3C,2H,1O|3C,2H,1O|3C,2H,1O)	[M+H]+	1
mzspec:GNPS:GNPS-LIBRARY:accession:CCMSLIB00009999359	CCMSLIB00009999359	0.89	7	Suspect related to Spectral Match to Tyr-Val from NIST14 (predicted molecular formula: C14H16N2O5) with delta m/z 11.964 (putative explanation: unspecified; atomic difference: unspecified)	[M+H]+	1
mzspec:GNPS:GNPS-LIBRARY:accession:CCMSLIB00009998309	CCMSLIB00009998309	0.88	5	Suspect related to Spectral Match to PyroGlu-Phe from NIST14 (predicted molecular formula: C14H16N2O5) with delta m/z 15.995 (putative explanation: Ala->Ser substitution|Oxidation or Hydroxylation|Phe->Tyr substitution; atomic difference: 1O|1O|1O)	[M+H]+	1
mzspec:GNPS:GNPS-LIBRARY:accession:CCMSLIB00009948510	CCMSLIB00009948510	0.86	6	Suspect related to Gly-Tyr (predicted molecular formula: C14H16N2O5) with delta m/z 54.01 (putative explanation: unspecified|Alkene fragment of DSSO crosslinker|MDA adduct +54|Methylglyoxal-derived hydroimidazolone|unspecified; atomic difference: 1C,3N|3C,2H,1O|3C,2H,1O|3C,2H,1O|3C,2H,1O)	[M+H]+	1
mzspec:GNPS:GNPS-LIBRARY:accession:CCMSLIB00003134646	CCMSLIB00003134646	0.81	5	Spectral Match to PyroGlu-Tyr from NIST14	M+H	1
mzspec:GNPS:GNPS-LIBRARY:accession:CCMSLIB00003135336	CCMSLIB00003135336	0.81	5	Spectral Match to PyroGlu-Tyr from NIST14	M+H	1
mzspec:GNPS:GNPS-LIBRARY:accession:CCMSLIB00009961826	CCMSLIB00009961826	0.78	5	Suspect related to Massbank:PR311057 Glutamyltyrosine (predicted molecular formula: C15H20N2O4) with delta m/z -17.974 (putative explanation: Asp->Pro substitution; atomic difference: 1C,2H,-2O)	[M+H]+	1
mzspec:GNPS:GNPS-LIBRARY:accession:CCMSLIB00009998310	CCMSLIB00009998310	0.76	5	Suspect related to Spectral Match to PyroGlu-Phe from NIST14 (predicted molecular formula: C15H20N2O4) with delta m/z 16.031 (putative explanation: Pro->Leu/Ile substitution|unspecified; atomic difference: 1C,4H|1C,4H)	[M+H]+	1
