USI	GNPSLibraryAccession	Cosine	Matching Peaks	CompoundName	Adduct	Charge
mzspec:GNPS:GNPS-LIBRARY:accession:CCMSLIB00009985826	CCMSLIB00009985826	0.77	7	Suspect related to Spectral Match to 1-Linoleoylglycerol from NIST14 (predicted molecular formula: C21H41NO4) with delta m/z 17.027 (putative explanation: replacement of proton with ammonium ion; atomic difference: 3H,1N)	[M+H]+	1
mzspec:GNPS:GNPS-LIBRARY:accession:CCMSLIB00009970115	CCMSLIB00009970115	0.75	5	Suspect related to NCGC00186665-03!2,3-dihydroxypropyl hexadecanoate [IIN-based: Match] (predicted molecular formula: unknown) with delta m/z 24.0 (putative explanation: unspecified; atomic difference: 2C)	[M+NH4]+	1
mzspec:GNPS:GNPS-LIBRARY:accession:CCMSLIB00009928623	CCMSLIB00009928623	0.73	6	Suspect related to 1-Linoleoylglycerol (predicted molecular formula: C21H41NO4) with delta m/z 17.027 (putative explanation: replacement of proton with ammonium ion; atomic difference: 3H,1N)	[M+H]+	1
mzspec:GNPS:GNPS-LIBRARY:accession:CCMSLIB00009928719	CCMSLIB00009928719	0.73	6	Suspect related to 1-Monolinoleoyl-rac-glycerol (predicted molecular formula: C22H44O2P) with delta m/z 17.027 (putative explanation: replacement of proton with ammonium ion; atomic difference: 3H,1N)	[M+H]+	1
mzspec:GNPS:GNPS-LIBRARY:accession:CCMSLIB00009988847	CCMSLIB00009988847	0.73	6	Suspect related to Spectral Match to 2-Linoleoylglycerol from NIST14 (predicted molecular formula: C22H44O2P) with delta m/z 17.027 (putative explanation: replacement of proton with ammonium ion; atomic difference: 3H,1N)	[M+H]+	1
