USI	GNPSLibraryAccession	Cosine	Matching Peaks	CompoundName	Adduct	Charge
mzspec:GNPS:GNPS-LIBRARY:accession:CCMSLIB00005489402	CCMSLIB00005489402	0.91	5	Spectral Match to Hexanedioic acid, bis(2-ethylhexyl) ester from NIST14 [IIN-based on: CCMSLIB00003137994]	[M+NH4]+	1
mzspec:GNPS:GNPS-LIBRARY:accession:CCMSLIB00009993806	CCMSLIB00009993806	0.88	5	Suspect related to Spectral Match to Hexanedioic acid, bis(2-ethylhexyl) ester from NIST14 (predicted molecular formula: C22H45NO4) with delta m/z 17.027 (putative explanation: replacement of proton with ammonium ion; atomic difference: 3H,1N)	[M+H]+	1
mzspec:GNPS:GNPS-LIBRARY:accession:CCMSLIB00009992491	CCMSLIB00009992491	0.87	6	Suspect related to Spectral Match to Dibutyl adipate from NIST14 (predicted molecular formula: C22H45NO4) with delta m/z 129.152 (putative explanation: unspecified; atomic difference: unspecified)	[M+H]+	1
mzspec:GNPS:GNPS-LIBRARY:accession:CCMSLIB00009943303	CCMSLIB00009943303	0.83	5	Suspect related to Bis(2-ethylhexyl) adipate (predicted molecular formula: C22H45NO4) with delta m/z 17.027 (putative explanation: replacement of proton with ammonium ion; atomic difference: 3H,1N)	[M+H]+	1
mzspec:GNPS:GNPS-LIBRARY:accession:CCMSLIB00009943304	CCMSLIB00009943304	0.73	5	Suspect related to Bis(2-ethylhexyl) adipate (predicted molecular formula: C23H47O4) with delta m/z 17.044 (putative explanation: unspecified; atomic difference: unspecified)	[M+H]+	1
