USI	GNPSLibraryAccession	Cosine	Matching Peaks	CompoundName	Adduct	Charge
mzspec:GNPS:GNPS-LIBRARY:accession:CCMSLIB00009997080	CCMSLIB00009997080	0.98	11	Suspect related to Spectral Match to Oleic acid ethyl ester from NIST14 (predicted molecular formula: C20H41NO2) with delta m/z 17.027 (putative explanation: replacement of proton with ammonium ion; atomic difference: 3H,1N)	[M+H]+	1
mzspec:GNPS:GNPS-LIBRARY:accession:CCMSLIB00009965552	CCMSLIB00009965552	0.94	10	Suspect related to Monoolein (predicted molecular formula: C20H41NO2) with delta m/z -28.979 (putative explanation: unspecified; atomic difference: unspecified)	[M+H]+	1
mzspec:GNPS:GNPS-LIBRARY:accession:CCMSLIB00009927435	CCMSLIB00009927435	0.8	9	Suspect related to 1,2-Dioleoyl-sn-glycerol (predicted molecular formula: unknown) with delta m/z -11.004 (putative explanation: unspecified; atomic difference: unspecified)	[M-C18H34O2+H]+	1
mzspec:GNPS:GNPS-LIBRARY:accession:CCMSLIB00009964691	CCMSLIB00009964691	0.8	9	Suspect related to Methyl 12-hydroxystearate (predicted molecular formula: C19H39NO4) with delta m/z 30.996 (putative explanation: unspecified; atomic difference: unspecified)	[M-H2O+H]+	1
mzspec:GNPS:GNPS-LIBRARY:accession:CCMSLIB00010003977	CCMSLIB00010003977	0.78	7	Suspect related to cis-12-Octadecenoic acid methyl ester (predicted molecular formula: C20H41NO2) with delta m/z 31.042 (putative explanation: Pro->Lys substitution|unspecified; atomic difference: 1C,5H,1N|1C,5H,1N)	[M+H]+	1
