USI	GNPSLibraryAccession	Cosine	Matching Peaks	CompoundName	Adduct	Charge
mzspec:GNPS:GNPS-LIBRARY:accession:CCMSLIB00010004599	CCMSLIB00010004599	0.75	4	Suspect related to cis-9-Hexadecenoic acid (predicted molecular formula: C14H28O2) with delta m/z -26.015 (putative explanation: Alkyl loss (typically partial loss from ring)|Pro->Ala substitution; atomic difference: -2C,-2H|-2C,-2H)	[M-H2O+H]+	1
mzspec:GNPS:GNPS-LIBRARY:accession:CCMSLIB00009931848	CCMSLIB00009931848	0.73	4	Suspect related to 13S-Hydroxy-9Z,11E-octadecadienoic acid, methyl ester (predicted molecular formula: unknown) with delta m/z -82.042 (putative explanation: NHS-Diazirine crosslinker (reverse)|nan (reverse); atomic difference: -5C,-6H,-1O|-5C,-6H,-1O)	[M-H2O+H]+	1
mzspec:GNPS:GNPS-LIBRARY:accession:CCMSLIB00009973089	CCMSLIB00009973089	0.73	4	Suspect related to NCGC00381425-01!8-hydroxy-8-(3-octyloxiran-2-yl)octanoic acid [IIN-based on: CCMSLIB00000846585] (predicted molecular formula: unknown) with delta m/z -68.026 (putative explanation: nan (reverse)|Crotonylation (reverse)|nan (reverse); atomic difference: -2C,-2H,-3N|-4C,-4H,-1O|-4C,-4H,-1O)	[M-2H2O+H]+	1
mzspec:GNPS:GNPS-LIBRARY:accession:CCMSLIB00009989491	CCMSLIB00009989491	0.73	5	Suspect related to Spectral Match to 9(10)-EpOME from NIST14 (predicted molecular formula: C14H28O2) with delta m/z -68.026 (putative explanation: nan (reverse)|Crotonylation (reverse)|nan (reverse); atomic difference: -2C,-2H,-3N|-4C,-4H,-1O|-4C,-4H,-1O)	[M-H2O+H]+	1
mzspec:GNPS:GNPS-LIBRARY:accession:CCMSLIB00009949170	CCMSLIB00009949170	0.72	4	Suspect related to Hexadecanedioic acid (predicted molecular formula: C11H24N3O3) with delta m/z -40.032 (putative explanation: Descyclopropyl, dealkenation|Pro->Gly substitution; atomic difference: -3C,-4H|-3C,-4H)	[M-2H2O+H]+	1
mzspec:GNPS:GNPS-LIBRARY:accession:CCMSLIB00009940023	CCMSLIB00009940023	0.72	5	Suspect related to 8S-Hydroxy-4Z,6E,10Z-hexadecatrienoic acid (predicted molecular formula: C13H24O3) with delta m/z -38.015 (putative explanation: Dealkyneation, dealkylation+aromatic ring opening; atomic difference: -3C,-2H)	[M-H2O+H]+	1
mzspec:GNPS:GNPS-LIBRARY:accession:CCMSLIB00009940191	CCMSLIB00009940191	0.72	5	Suspect related to 9(10)-Epoxy-12Z-octadecenoic acid (predicted molecular formula: C14H28O2) with delta m/z -68.026 (putative explanation: nan (reverse)|Crotonylation (reverse)|nan (reverse); atomic difference: -2C,-2H,-3N|-4C,-4H,-1O|-4C,-4H,-1O)	[M-H2O+H]+	1
mzspec:GNPS:GNPS-LIBRARY:accession:CCMSLIB00009932642	CCMSLIB00009932642	0.71	4	Suspect related to 17-Octadecynoic acid (predicted molecular formula: C14H28O2) with delta m/z -52.03 (putative explanation: nan (reverse); atomic difference: -4C,-4H)	[M-H2O+H]+	1
mzspec:GNPS:GNPS-LIBRARY:accession:CCMSLIB00010001686	CCMSLIB00010001686	0.71	5	Suspect related to Tetradecanedioic acid (predicted molecular formula: C11H24N3O3) with delta m/z -12.0 (putative explanation: formaldehyde adduct (reverse)|methylation and reduction (reverse)|nan (reverse); atomic difference: -1C|-1C|-1C)	[M-2H2O+H]+	1
