USI	GNPSLibraryAccession	Cosine	Matching Peaks	CompoundName	Adduct	Charge
mzspec:GNPS:GNPS-LIBRARY:accession:CCMSLIB00009962689	CCMSLIB00009962689	0.71	4	Suspect related to Massbank:RP025402 Tetradecanoyl-L-Carnitine|L-Myristoylcarnitine|(3R)-3-tetradecanoyloxy-4-(trimethylazaniumyl)butanoate (predicted molecular formula: C23H43NO4) with delta m/z 26.016 (putative explanation: Acetaldehyde +26|Ala->Pro substitution|unspecified; atomic difference: 2C,2H|2C,2H|2C,2H)	[M+H]+	1
mzspec:GNPS:GNPS-LIBRARY:accession:CCMSLIB00009977922	CCMSLIB00009977922	0.71	4	Suspect related to PALMITOYLCARNITINE (predicted molecular formula: C23H43NO4) with delta m/z -2.016 (putative explanation: 2-amino-3-oxo-butanoic_acid|Intact disulfide bridge|Val->Pro substitution; atomic difference: -2H|-2H|-2H)	[M+H]+	1
mzspec:GNPS:GNPS-LIBRARY:accession:CCMSLIB00009962620	CCMSLIB00009962620	0.71	4	Suspect related to Massbank:RP025103 Oleoyl-L-Carnitine|(3R)-3-[(Z)-octadec-9-enoyl]oxy-4-(trimethylazaniumyl)butanoate (predicted molecular formula: C23H43NO4) with delta m/z -28.031 (putative explanation: Desethylation, didemethylation, dealkylation|Met->Cys substitution|Val->Ala substitution; atomic difference: -2C,-4H|-2C,-4H|-2C,-4H)	[M+H]+	1
mzspec:GNPS:GNPS-LIBRARY:accession:CCMSLIB00009997437	CCMSLIB00009997437	0.7	4	Suspect related to Spectral Match to Palmitoylcarnitine from NIST14 (predicted molecular formula: C19H39N7O2) with delta m/z -2.016 (putative explanation: 2-amino-3-oxo-butanoic_acid|Intact disulfide bridge|Val->Pro substitution; atomic difference: -2H|-2H|-2H)	[M+H]+	1
mzspec:GNPS:GNPS-LIBRARY:accession:CCMSLIB00009962537	CCMSLIB00009962537	0.7	4	Suspect related to Massbank:RP024902 Decanoyl-L-Carnitine|Decanoylcarnitine|3-decanoyloxy-4-(trimethylazaniumyl)butanoate (predicted molecular formula: C23H43NO4) with delta m/z 82.078 (putative explanation: unspecified; atomic difference: 6C,10H)	[M+H]+	1
